<?xml version="1.0" encoding="GB2312"?>
<!DOCTYPE FTD SYSTEM "ftd.1.dtd">
<ftd>
    <packages>
        <packageDefine name="Error" tid="TID_Error" model="dialog" comment="错误响应">
            <field name="ErrorField" maxOccur="1" minOccur="1" comment="错误域"/>
            <field name="ErrorTargetSequenceField" maxOccur="1" minOccur="0" comment="错误序列号域"/>
            <field name="ErrorTargetOrderField" maxOccur="1" minOccur="0" comment="错误报单号域"/>
        </packageDefine>
        <packageDefine name="ForceExit" tid="TID_ForceExit" model="none" comment="强制退出">
            <field name="ForceExitField" maxOccur="1" minOccur="1" comment="强制退出域"/>
        </packageDefine>
        <packageDefine name="InstrumentChangeNotify" tid="TID_InstrumentChangeNotify" model="broadcast" comment="合约参数改变通知">
            <field name="InstrumentField" maxOccur="1" minOccur="1" comment="合约域"/>
            <field name="ErrorField" maxOccur="1" minOccur="0" comment="错误域"/>
        </packageDefine>
        <packageDefine name="InstrumentStatusChangeNotify" tid="TID_InstrumentStatusChangeNotify" model="broadcast" comment="合约状态改变通知">
            <field name="InstrumentStatusField" maxOccur="1" minOccur="1" comment="合约状态域 "/>
            <field name="ErrorField" maxOccur="1" minOccur="0" comment="错误域"/>
        </packageDefine>
        <packageDefine name="MarketBulletin" tid="TID_MarketBulletin" model="broadcast" comment=" 交易所告示广播">
            <field name="BulletinField" maxOccur="1" minOccur="1" comment="告示域"/>
        </packageDefine>
        <packageDefine name="MarketStatusChangeNotify" tid="TID_MarketStatusChangeNotify" model="broadcast" comment="市场状态改变通知">
            <field name="MarketStatusField" maxOccur="1" minOccur="1" comment="市场状态域"/>
            <field name="ErrorField" maxOccur="1" minOccur="0" comment="错误域"/>
        </packageDefine>
        <packageDefine name="MarketMatchIncData" tid="TID_MarketMatchIncData" model="broadcast" comment="增量成交行情">
            <field name="MarketMatchIncDataField" maxOccur="任意" minOccur="1" comment="增量成交行情域"/>
            <field name="ErrorField" maxOccur="1" minOccur="0" comment="错误域"/>
        </packageDefine>
        <packageDefine name="MarketMatchData" tid="TID_MarketMatchData" model="broadcast" comment="成交行情">
            <field name="MarketMatchDataField" maxOccur="任意" minOccur="0" comment="成交行情域"/>
            <field name="MarketMatchDataChgField" maxOccur="任意" minOccur="0" comment="成交行情变化域"/>
        </packageDefine>
        <packageDefine name="OrderConfirmation" tid="TID_OrderConfirmation" model="private" comment="报单确认">
            <field name="OrderStatusField" maxOccur="1" minOccur="1" comment="报单状态域"/>
            <field name="ErrorField" maxOccur="1" minOccur="0" comment="错误域"/>
        </packageDefine>
        <packageDefine name="MarketOrderIncData" tid="TID_MarketOrderIncData" model="broadcast" comment="增量报单行情">
            <field name="MarketOrderDataField" maxOccur="任意" minOccur="1" comment="报单行情域"/>
            <field name="ErrorField" maxOccur="1" minOccur="0" comment="错误域"/>
        </packageDefine>
        <packageDefine name="ParticipantBulletin" tid="TID_ParticipantBulletin" model="private" comment="会员告示">
            <field name="BulletinField" maxOccur="1" minOccur="1" comment="告示域"/>
        </packageDefine>
        <packageDefine name="ReqOrderAction" tid="TID_OrderAction" model="dialog" comment="报单操作请求">
            <field name="OrderActionField" maxOccur="1" minOccur="1" comment="报单操作域"/>
        </packageDefine>
        <packageDefine name="ReqOrderInsert" tid="TID_OrderInsert" model="dialog" comment="报单录入">
            <field name="OrderInsertField" maxOccur="1" minOccur="1" comment="报单信息域"/>
        </packageDefine>
        <packageDefine name="ReqQryClient" tid="TID_QryClient" model="dialog" comment="客户信息查询">
            <field name="ReqQryClientField" maxOccur="1" minOccur="1" comment="客户查询请求域 "/>
        </packageDefine>
        <packageDefine name="ReqQryDeposit" tid="TID_QryDeposit" model="dialog" comment="会员资金查询">
            <field name="ReqQryDepositField" maxOccur="1" minOccur="1" comment="会员资金查询域"/>
        </packageDefine>
        <packageDefine name="ReqQryInstrument" tid="TID_QryInstrument" model="dialog" comment=" 合约查询">
            <field name="ReqQryInstrumentField" maxOccur="1" minOccur="1" comment="合约查询请 求域"/>
        </packageDefine>
        <packageDefine name="ReqQryInstrumentStatus" tid="TID_QryInstrumentStatus" model="dialog" comment="查询合约交易状态请求">
            <field name="ReqQryInstrumentStatusField" maxOccur="1" minOccur="1" comment="合约状 态查询响应域"/>
        </packageDefine>
        <packageDefine name="ReqQryMarket" tid="TID_QryMarket" model="dialog" comment="市场查 询请求">
            <field name="ReqQryMarketField" maxOccur="1" minOccur="1" comment="市场查询请求 域"/>
        </packageDefine>
        <packageDefine name="ReqQryMarketStatus" tid="TID_QryMarketStatus" model="dialog" comment="查询市场交易状态请求">
            <field name="ReqQryMarketStatusField" maxOccur="1" minOccur="1" comment="市场状态查询请求域"/>
        </packageDefine>
        <packageDefine name="ReqQryOrder" tid="TID_QryOrder" model="dialog" comment="报单查询">
            <field name="ReqQryOrderField" maxOccur="1" minOccur="1" comment="报单查询请求域"/>
        </packageDefine>
        <packageDefine name="ReqQryMarketOrderData" tid="TID_QryMarketOrderData" model="dialog" comment="报单行情查询请求">
            <field name="ReqQryMarketOrderDataField" maxOccur="1" minOccur="1" comment="报单行情查询域"/>
        </packageDefine>
        <packageDefine name="ReqQryParticipant" tid="TID_QryParticipant" model="dialog" comment="会员信息查询">
            <field name="ReqQryParticipantField" maxOccur="1" minOccur="1" comment="会员查询请求域"/>
        </packageDefine>
        <packageDefine name="ReqQryPosition" tid="TID_QryPosition" model="dialog" comment="会员客户持仓查询">
            <field name="ReqQryPositionField" maxOccur="1" minOccur="1" comment="客户持仓查询请求域"/>
        </packageDefine>
        <packageDefine name="ReqQryPPosition" tid="TID_QryPPosition" model="dialog" comment="会员持仓查询">
            <field name="ReqQryPPositionField" maxOccur="1" minOccur="1" comment="会员持仓查 询请求域"/>
        </packageDefine>
        <packageDefine name="ReqQryMarketMatchData" tid="TID_QryMarketMatchData" model="dialog" comment="成交行情查询">
            <field name="ReqQryMarketMatchDataField" maxOccur="1" minOccur="1" comment="成交行情查询请求域"/>
        </packageDefine>
        <packageDefine name="ReqQryTrade" tid="TID_QryTrade" model="dialog" comment="成交单查询">
            <field name="ReqQryTradeField" maxOccur="1" minOccur="1" comment="成交查询请求域"/>
        </packageDefine>
        <packageDefine name="ReqQryUser" tid="TID_QryUser" model="dialog" comment="查询交易员请求">
            <field name="ReqQryUserField" maxOccur="1" minOccur="1" comment="交易员查询域"/>
        </packageDefine>
        <packageDefine name="ReqQryUserLogin" tid="TID_QryUserLogin" model="dialog" comment="交易员在线查询">
            <field name="ReqQryUserLoginField" maxOccur="1" minOccur="1" comment="交易员在线查询域"/>
        </packageDefine>
        <packageDefine name="ReqUserLogin" tid="TID_UserLogin" model="none" comment="交易员登录请求">
            <field name="ReqUserLoginField" maxOccur="1" minOccur="1" comment="交易员登录请求 域"/>
            <field name="DisseminationstartField" maxOccur="1" minOccur="0" comment="发送信息起始说明域"/>
        </packageDefine>
        <packageDefine name="ReqUserLogout" tid="TID_UserLogout" model="none" comment="交易员登录退出">
            <field name="ReqUserLogoutField" maxOccur="1" minOccur="1" comment="交易员退出登录请求域"/>
        </packageDefine>
        <packageDefine name="ReqUserPasswordUpdate" tid="TID_UserPasswordUpdate" model="dialog" comment="交易员修改密码">
            <field name="ReqUserPasswordUpdateField" maxOccur="1" minOccur="1" comment="交易员修改口令请求域"/>
        </packageDefine>
        <packageDefine name="RspQryUserLogin" tid="TID_QryUserLogin" model="dialog" comment="交易员在线查询应答">
            <field name="UserLoginField" maxOccur="任意" minOccur="1" comment="交易员在线域"/>
            <field name="ErrorField" maxOccur="1" minOccur="0" comment="错误域"/>
        </packageDefine>
        <packageDefine name="RspOrderAction" tid="TID_OrderAction" model="dialog" comment="报单操作应答">
            <field name="OrderActionField" maxOccur="1" minOccur="1" comment="报单操作域"/>
            <field name="ErrorField" maxOccur="1" minOccur="0" comment="错误域"/>
        </packageDefine>
        <packageDefine name="RspOrderInsert" tid="TID_OrderInsert" model="dialog" comment="报单应答">
            <field name="OrderInsertField" maxOccur="1" minOccur="1" comment="报单信息域"/>
            <field name="ErrorField" maxOccur="1" minOccur="0" comment="错误域"/>
        </packageDefine>
        <packageDefine name="RspQryClient" tid="TID_QryClient" model="dialog" comment="客户信息查询应答">
            <field name="ClientField" maxOccur="任意" minOccur="1" comment="客户域"/>
            <field name="ErrorField" maxOccur="1" minOccur="0" comment="错误域"/>
        </packageDefine>
        <packageDefine name="RspQryDeposit" tid="TID_QryDeposit" model="dialog" comment="会员资金查询应答">
            <field name="DepositField" maxOccur="任意" minOccur="1" comment="会员资金域"/>
            <field name="ErrorField" maxOccur="1" minOccur="0" comment="错误域"/>
        </packageDefine>
        <packageDefine name="RspQryInstrument" tid="TID_QryInstrument" model="dialog" comment="合约查询应答">
            <field name="InstrumentField" maxOccur="任意" minOccur="1" comment="合约域"/>
            <field name="ErrorField" maxOccur="1" minOccur="0" comment="错误域"/>
        </packageDefine>
        <packageDefine name="RspQryInstrumentStatus" tid="TID_QryInstrumentStatus" model="dialog" comment="查询合约交易状态应答">
            <field name="InstrumentStatusField" maxOccur="任意" minOccur="1" comment="合约状态域"/>
            <field name="ErrorField" maxOccur="1" minOccur="0" comment="错误域"/>
        </packageDefine>
        <packageDefine name="RspQryMarket" tid="TID_QryMarket" model="dialog" comment="市场查询应答">